{
  "meta": {
    "id": "go4it-sports-gpt-v4",
    "version": "4.0.0",
    "channel": "production",
    "author": "Go4it Sports Academy",
    "last_updated": "2025-10-22",
    "homepage": "https://go4itsports.org",
    "repository": "https://github.com/Shatzii/Go4it-V2",
    "documentation": "https://github.com/Shatzii/Go4it-V2/blob/main/gpt/README.md",
    "description": "Complete AI command center for Go4it Sports Academy - NCAA Pathway, Athlete Development, and Sports Management",
    "cache": {
      "ttl_minutes": 15,
      "max_age_seconds": 900
    },
    "mirrors": {
      "primary": "https://go4itsports.org/gpt/go4it_actions_pro.json",
      "github_raw": "https://raw.githubusercontent.com/Shatzii/Go4it-V2/main/gpt/go4it_actions_pro.json",
      "versioned": "https://raw.githubusercontent.com/Shatzii/Go4it-V2/main/gpt/versions/go4it_actions_v4.0.0.json"
    }
  },
  "brand": {
    "name": "Go4it Sports Academy",
    "tagline": "Train Here. Place Anywhere.",
    "contacts": {
      "email": "info@go4itsports.org",
      "phone": "+1-555-GO4-IT",
      "address": "Sports Academy Campus, Vienna, Austria"
    },
    "locations": ["Vienna, Austria", "Denver, USA", "Global Online"],
    "palette": {
      "primary": "#1e40af",
      "secondary": "#f59e0b",
      "accent": "#10b981"
    },
    "truth_in_marketing": "Go4it Sports Academy provides educational and athletic development services. We do not guarantee athletic scholarships, professional contracts, or specific outcomes. All programs are designed to maximize student-athlete potential through comprehensive training and education."
  },
  "open_source_stack": {
    "frontend": "Next.js 14, React, TypeScript, Tailwind CSS",
    "backend": "Next.js API Routes, Node.js",
    "database": "PostgreSQL with Drizzle ORM",
    "ai_models": "OpenAI GPT-4, Claude, Custom Fine-tuned Models",
    "integrations": "Stripe, SendGrid, Twilio, Slack, Airtable, Odoo, Mautic"
  },
  "lead_funnel_stages": {
    "awareness": ["website_visit", "social_media", "referral"],
    "interest": ["newsletter_signup", "demo_request", "info_download"],
    "consideration": ["trial_enrollment", "consultation_booked", "assessment_taken"],
    "intent": ["application_submitted", "payment_initiated", "contract_signed"],
    "purchase": ["enrolled", "first_payment", "orientation_completed"],
    "retention": ["active_student", "progress_milestones", "renewal_eligible"],
    "advocacy": ["alumni", "referral_source", "success_story"]
  },
  "knowledge_sources": {
    "academic": ["NCAA Handbook", "FIFA Regulations", "Academic Standards"],
    "sports_science": ["Training Methodology", "Injury Prevention", "Performance Analytics"],
    "business": ["Sports Management", "Marketing Strategies", "Financial Planning"],
    "legal": ["Compliance Policies", "Contract Templates", "Risk Management"]
  },
  "event_templates": {
    "fnl": {
      "name": "Friday Night Lights",
      "duration": "3 days",
      "capacity": 200,
      "focus": "Recruiting showcase with college coaches"
    },
    "soccer_camp": {
      "name": "Elite Soccer Development Camp",
      "duration": "5 days",
      "capacity": 50,
      "focus": "Technical and tactical development"
    },
    "combine": {
      "name": "Athletic Combine Assessment",
      "duration": "2 days",
      "capacity": 100,
      "focus": "Performance testing and evaluation"
    }
  },
  "system_status": {
    "api_health": "/api/health",
    "database_status": "PostgreSQL Active",
    "ai_services": "OpenAI GPT-4 Available",
    "integrations": ["Stripe", "SendGrid", "Twilio", "Slack"]
  },
  "pricing": {
    "pathway_starter": {"price": 299, "currency": "EUR", "billing": "monthly"},
    "pathway_premium": {"price": 599, "currency": "EUR", "billing": "monthly"},
    "event_ticket": {"price": 149, "currency": "EUR", "billing": "one-time"},
    "consultation": {"price": 199, "currency": "EUR", "billing": "one-time"}
  },
  "kpi_targets": {
    "monthly_enrollments": 25,
    "event_attendance": 150,
    "student_retention": 0.85,
    "revenue_target": 50000
  },
  "sales_kpi_targets": {
    "lead_conversion": 0.15,
    "demo_to_sale": 0.30,
    "average_deal_size": 800,
    "sales_cycle_days": 21
  },
  "compliance_policies": {
    "ncaa_amateurism": "Strict compliance with NCAA amateurism rules",
    "gdpr_compliance": "Full GDPR compliance for EU operations",
    "data_protection": "Student-athlete data protected under FERPA",
    "truth_in_marketing": "No guaranteed outcomes or scholarships"
  },
  "localization": {
    "supported_languages": ["en", "de", "es"],
    "default_locale": "en-US",
    "timezone": "Europe/Vienna"
  },
  "model_settings": {
    "creativity": 0.7,
    "formality": 0.8,
    "compliance_filter": true,
    "guardian_mode": true
  },
  "voice_presets": {
    "parent": {"tone": "supportive", "formality": 0.6, "empathy": 0.9},
    "athlete": {"tone": "motivational", "formality": 0.4, "energy": 0.9},
    "coach": {"tone": "authoritative", "formality": 0.8, "directness": 0.8},
    "sponsor": {"tone": "professional", "formality": 0.9, "persuasive": 0.7}
  },
  "guardian_mode": {
    "enabled": true,
    "filters": ["scholarship_guarantees", "contract_promises", "agent_references"],
    "compliance_level": "strict"
  },
  "integrations": {
    "stripe": {"status": "active", "webhooks": true},
    "sendgrid": {"status": "active", "templates": true},
    "twilio": {"status": "active", "messaging": true},
    "slack": {"status": "active", "channels": ["sales", "events", "support"]},
    "airtable": {"status": "active", "bases": ["leads", "events", "students"]},
    "odoo": {"status": "active", "modules": ["crm", "sales", "events"]},
    "mautic": {"status": "active", "campaigns": true}
  },
  "soccer_specific_messaging": {
    "terminology": ["football", "pitch", "goal", "striker", "midfielder"],
    "cultural_context": "European football culture with American college pathway",
    "motivational_themes": ["teamwork", "discipline", "technical_excellence"]
  },
  "sales_automation_workflows": {
    "lead_nurture": ["welcome_email", "demo_booking", "follow_up_sequence"],
    "event_sales": ["early_bird", "regular", "last_minute"],
    "retention": ["check_in", "progress_review", "renewal_offer"]
  },
  "action_roles": {
    "admin": ["full_access", "system_config", "user_management"],
    "coach": ["student_management", "content_creation", "assessment"],
    "sales": ["lead_management", "event_creation", "pricing"],
    "support": ["ticket_management", "communication", "reporting"]
  },
  "self_update": {
    "auto_update": true,
    "update_frequency": "daily",
    "rollback_enabled": true
  },
  "testing": {
    "smoke_tests": ["api_health", "database_connection", "ai_services"],
    "integration_tests": ["stripe_webhooks", "email_delivery", "sms_delivery"],
    "performance_tests": ["api_response_times", "concurrent_users"]
  },
  "actions": [
    {
      "name": "/plan90d",
      "category": "Planning & Strategy",
      "description": "Create a comprehensive 90-day development plan for student-athletes",
      "input_schema": {
        "type": "object",
        "properties": {
          "start_date": {"type": "string", "format": "date"},
          "athlete_profile": {"type": "object"},
          "goals": {"type": "array", "items": {"type": "string"}},
          "focus_areas": {"type": "array", "items": {"type": "string"}}
        },
        "required": ["start_date"]
      }
    },
    {
      "name": "/eventpack",
      "category": "Event Management",
      "description": "Create complete event packages (FNL, Soccer Camps, Combines)",
      "input_schema": {
        "type": "object",
        "properties": {
          "event_type": {"type": "string", "enum": ["fnl", "soccer", "combine"]},
          "city": {"type": "string"},
          "date": {"type": "string", "format": "date"},
          "venue": {"type": "string"},
          "capacity": {"type": "number"},
          "pricing": {"type": "object"}
        },
        "required": ["event_type", "city", "date"]
      }
    },
    {
      "name": "/sponsor-memo",
      "category": "Business Development",
      "description": "Generate professional sponsor proposal memos",
      "input_schema": {
        "type": "object",
        "properties": {
          "city": {"type": "string"},
          "month": {"type": "string", "format": "date"},
          "sponsor_name": {"type": "string"},
          "event_type": {"type": "string"},
          "value_proposition": {"type": "string"}
        },
        "required": ["city", "month", "sponsor_name"]
      }
    },
    {
      "name": "/adset",
      "category": "Marketing",
      "description": "Create targeted ad sets for different audiences",
      "input_schema": {
        "type": "object",
        "properties": {
          "audience": {"type": "string", "enum": ["parent", "athlete", "coach", "sponsor"]},
          "objective": {"type": "string", "enum": ["awareness", "engagement", "conversion", "retargeting"]},
          "budget": {"type": "number"},
          "platforms": {"type": "array", "items": {"type": "string"}}
        },
        "required": ["audience", "objective"]
      }
    },
    {
      "name": "/audit-eligibility",
      "category": "Compliance",
      "description": "Check NCAA/FIFA eligibility requirements",
      "input_schema": {
        "type": "object",
        "properties": {
          "country": {"type": "string"},
          "sport": {"type": "string"},
          "age": {"type": "number"},
          "academic_status": {"type": "string"},
          "competition_level": {"type": "string"}
        },
        "required": ["country", "sport", "age"]
      }
    },
    {
      "name": "/translate-localize",
      "category": "Content",
      "description": "Translate and localize content for different markets",
      "input_schema": {
        "type": "object",
        "properties": {